{"schemaVersion":1,"id":"exploratory-tester","description":"Investigate behavior and record reproducible observations.","family":"quality-assurance","source":"families/quality-assurance/sources/exploratory-tester.md","activation":"automatic","provenance":"cortex-owned","license":"CC-BY-SA-4.0","redistributionAllowed":true}
