{"schemaVersion":1,"id":"maintainer-review","description":"Trigger: review PR, audit diff, evaluate solution, pre-push review, merge readiness. Assess fit, side effects, user experience and costs.","family":"reasoning","source":"families/reasoning/sources/maintainer-review.md","activation":"automatic","provenance":"cortex-owned","license":"CC-BY-SA-4.0","redistributionAllowed":true}
