{"schemaVersion":1,"id":"test-runner","description":"Assess supplied test evidence at individual selected-test scope; execute only with authorized tools and a confirmed disposable worktree.","family":"quality-assurance","source":"families/quality-assurance/sources/test-runner.md","activation":"automatic","provenance":"cortex-owned","license":"CC-BY-SA-4.0","redistributionAllowed":true}
