{"schemaVersion":1,"id":"maintainer-delivery","description":"Use when the operator takes an issue and wants it merged fast, or juggles several PRs in flight. Advisory issue-to-merge checklist for issue-first repos; the operator decides and runs every step.","family":"reasoning","source":"families/reasoning/sources/maintainer-delivery.md","activation":"automatic","provenance":"cortex-owned","license":"CC-BY-SA-4.0","redistributionAllowed":true}